Secao,Titulo,Descrição,Data
economia,"Na China, PBoC mantém as principais taxas de juros inalteradas, como esperado","O Banco do Povo da China (PBoC, o BC chinês) manteve suas principais taxas de juros inalteradas, como sinalizado no início desta semana. Em comunicado divulgado nesta quinta-feira, 20, pelo horário local, o PBoC informou que manteve a taxa de juros de referência para empréstimos (LPR, na sigla em inglês) de 1 ano em 3,65% […]",20/04/2023 07:08
economia,O real está mais forte ou o dólar mais fraco?,"Diante de uma combinação de fatores internos e externos, a moeda brasileira ganha musculatura diante da divisa americana. O rumo da disputa, no entanto, segue incerto.",20/04/2023 04:20
economia,Planejando no improviso,Lei de Diretrizes Orçamentárias feita por Simone Tebet pode ser excelente — desde que o arcabouço fiscal e a reforma tributária sejam devidamente aprovados.,20/04/2023 04:10
economia,Na lente de Haddad,"Ministro da Fazenda apresenta projeto de Arcabouço Fiscal, promete cruzada contra subsídios indevidos, mas já recua na questão da importação.",20/04/2023 04:00
economia,Estacionamento desaba em Nova York; assista ao vídeo,"Parte de um prédio usado como estacionamento desabou na cidade de Nova York, nos Estados Unidos, nesta terça-feira (18), provocando a morte de uma pessoa e deixando outras feridas. O acidente aconteceu na região de Manhattan, quando o segundo andar do estacionamento desmoronou sobre o andar inferior. De acordo com testemunhas, funcionários e clientes do […]",19/04/2023 23:00
economia,Biden e republicanos iniciam novo ‘round’ sobre dívida,"Um se apresenta como o defensor dos trabalhadores, o outro como garantidor da disciplina fiscal: o presidente Joe Biden e o líder dos republicanos na Câmara dos Representantes, Kevin McCarthy, estão travando uma batalha feroz sobre a dívida americana. “O povo americano deve saber quais são as visões econômicas conflitantes sobre as quais falamos hoje”, […]",19/04/2023 22:18
economia,"Família Maluf paga R$152,8 milhões em acordo por desvio na Prefeitura de SP","A família do ex-prefeito Paulo Maluf, pela empresa Eucatex e o Banco BTG Pactual, depositaram nesta quarta-feira (19), R$152,8 milhões na conta da Prefeitura de São Paulo como parte do acordo firmado entre Ministério Público e a Procuradoria-Geral da cidade para a devolução de US$44 milhões (R$222 milhões) aos cofres do município. Ainda devem ser […]",19/04/2023 21:50
economia,Suprema Corte dos EUA estende bloqueio a restrição de pílulas abortivas até sexta-feira,Por Andrew Chung WASHINGTON (Reuters) – O juiz da Suprema Corte dos Estados Unidos Samuel Alito estendeu nesta quarta-feira por dois dias um bloqueio temporário aos limites estabelecidos por tribunais inferiores para o acesso à pílula abortiva mifepristona após uma ação de grupos antiaborto à aprovação regulatória federal do medicamento. A decisão de manter o […],19/04/2023 21:39
economia,"Enigma do rendimento do milho nos EUA: 181,5 ou ainda mais?","Por Karen Braun NAPERVILLE, ILLINOIS (Reuters) – As possibilidades de rendimento do milho dos EUA para este verão ainda estão abertas, embora os participantes da indústria possam discordar sobre o que representa um rendimento “normal” devido a algumas tendências recentes. Nas últimas quatro temporadas, o rendimento do milho dos EUA caiu abaixo da tendência inicial […]",19/04/2023 21:33
economia,Israel diz que visita à Arábia Saudita está “na mesa”,"JERUSALÉM (Reuters) – O ministro das Relações Exteriores de Israel, Eli Cohen, apresentou nesta quarta-feira a perspectiva de uma futura visita à Arábia Saudita e disse que pelo menos mais um país árabe normalizaria os laços com seu país este ano. “Esta (visita à Arábia Saudita) está na mesa, ainda não há data”, disse ele, […]",19/04/2023 20:01
economia,STF: fim da incidência de ICMS sobre transferência de mercadorias vale a partir de 2024,"O Supremo Tribunal Federal (STF) proclamou na tarde desta quarta-feira, 19, o resultado do julgamento que discute o destino dos créditos de ICMS – a ADC 49, que tem impacto bilionário para o varejo e o comércio eletrônico. Ficou definido que os efeitos da decisão que proibiu a incidência de ICMS sobre o envio de […]",19/04/2023 19:32
economia,"EUA: republicanos propõem aumentar teto da dívida em US$ 1,5 tri, em troca de cortes de gastos","Lideranças republicanas na Câmara dos Representantes dos Estados Unidos divulgaram nesta quarta-feira, 19, uma proposta para aumentar o teto da dívida americana em US$ 1,5 trilhão ou até 31 de março de 2024, em troca de limites para parte da agenda expansionista do presidente Joe Biden. A matéria deve ser analisada no plenário da Casa […]",19/04/2023 19:24
economia,Fux marca audiência de conciliação sobre decretos do saneamento para 23/05,"O ministro Luiz Fux, do Supremo Tribunal Federal (STF), marcou uma audiência de conciliação antes de decidir sobre o pedido de liminar apresentado pelo partido Novo para derrubar os decretos do presidente Luiz Inácio Lula da Silva (PT) sobre saneamento. A audiência foi marcada para o dia 23 de maio, às 14h, no gabinete de […]",19/04/2023 19:23
economia,Moldávia convoca embaixador russo para expulsar membro da embaixada e desagrada Moscou,"CHISINAU (Reuters) – A Moldávia, pequeno país do leste europeu, convocou o embaixador russo Oleg Vasnetsov nesta quarta-feira para declarar um membro da equipe da embaixada persona non grata, gerando reclamação por parte do governo de Moscou. O secretário de imprensa do governo moldavo, Daniel Voda, disse a jornalistas que a decisão estava ligada às […]",19/04/2023 19:16
economia,Banco turco acusado de violar sanções contra o Irã sofre revés judicial nos EUA,"A Suprema Corte dos Estados Unidos rechaçou, nesta quarta-feira (19), a pretensão de imunidade soberana do banco estatal turco Halkbank, acusado de violar as sanções contra o Irã, em um caso que aumentou a tensão entre Washington e Ancara. O Halkbank foi acusado em 2019 pela Justiça americana de participação em um esquema para lavar […]",19/04/2023 19:10
economia,Ministro do GSI cai após divulgação de vídeo de golpistas no Planalto em 8/1,"Por Lisandra Paraguassu BRASÍLIA (Reuters) – O ministro do Gabinete de Segurança Institucional (GSI), general da reserva Marco Edson Gonçalves Dias, pediu demissão nesta quarta-feira, se tornando o primeiro integrante do gabinete do presidente Luiz Inácio Lula da Silva a cair neste terceiro mandato. A saída de GDias, como é conhecido, acontece depois que a […]",19/04/2023 19:05
economia,Preços do açúcar bruto fecham em queda na ICE após máxima de 11 anos,"NOVA YORK/LONDRES (Reuters) – Os contratos futuros de açúcar bruto fecharam em baixa na ICE nesta quarta-feira, após subirem para um pico de 11 anos, enquanto os contratos de cacau avançaram para seu nível mais alto em 6 anos e meio. AÇÚCAR * O açúcar bruto de maio caiu 0,17 centavo, ou 0,7%, a 24,37 […]",19/04/2023 19:00
economia,Futuros de grãos de Chicago caem com retomada das inspeções na Ucrânia,"Por Cassandra Garrison CIDADE DO MÉXICO (Reuters) – Os futuros de grãos e soja de Chicago fecharam em baixa nesta quarta-feira, depois que as inspeções de navios que transportam grãos ucranianos do Mar Negro foram retomadas, e a queda do petróleo pressionou os preços para baixo. Uma autoridade ucraniana disse que “as inspeções de navios […]",19/04/2023 18:57
economia,EUA impõem sanções a rede de apoio a drones e programas militares do Irã,"Por Daphne Psaledakis WASHINGTON (Reuters) – Os Estados Unidos impuseram sanções nesta quarta-feira a uma rede de compras que acusou de apoiar os programas militares e de drones do Irã, visando empresas e fornecedores na China, Irã e de outros lugares, em uma nova ação destinada a aumentar a pressão sobre Teerã. O Departamento do […]",19/04/2023 18:33
economia,Agronegócio do Brasil reage à lei da UE sobre desmatamento e contesta termos,"Por Roberto Samora e Kate Abnett SÃO PAULO/BRUXELAS (Reuters) – A aprovação de uma lei pelo Parlamento da União Europeia contra importações de produtos ligados ao desmatamento não respeita o código florestal do Brasil, que prevê desflorestamento legal de parte das propriedades rurais, reagiu uma importante associação do agronegócio brasileiro, cujo setor também acredita ser […]",19/04/2023 18:27
economia,Receita abre consulta a lote residual de restituição do IR nesta quinta (20),"A Receita Federal vai abre nesta quinta-feira (20) consulta ao lote residual de restituição do Imposto de Renda de anos anteriores. A consulta estará disponível ao contribuinte a partir das 10h. Serão contemplados 290.934 contribuintes, no valor superior a R$ 344 milhões. O pagamento será feito no dia 28 de abril na conta bancária indicada […]",19/04/2023 18:21
economia,Aprovação rápida e aumento de impostos: saiba como o arcabouço fiscal chega ao Congresso,"O governo enviou, na tarde desta terça-feira (18), o Projeto de Lei Complementar (PLP 93/23) do Arcabouço Fiscal para o Congresso Nacional.  De acordo com as novas regras fiscais, o crescimento real da despesa do governo será limitado a 70% da variação real das receitas do ano anterior. O governo acredita que o país deve […]",19/04/2023 18:11
economia,Governo quita dívida de R$ 500 milhões com fundo do Mercosul,"O governo brasileiro quitou a dívida de R$ 500 milhões com o Fundo para a Convergência Estrutural do Mercosul, informaram em nota conjunta os ministérios das Relações Exteriores e do Planejamento e Orçamento. A quitação da dívida, informou o governo, reforça o compromisso com a integração regional e permite a reativação desse mecanismo estratégico, a […]",19/04/2023 18:03
economia,TCU dá aval à primeira relicitação de rodovias federais com determinações à ANTT,"O Tribunal de Contas da União (TCU) aprovou nesta quarta-feira, 19, o primeiro processo de relicitação de rodovias federais. O modelo, referente a uma nova concessão de trechos que ligam Minas Gerais a Rio de Janeiro, poderá ser aplicado pelo governo nas próximas relicitações rodoviárias. O instrumento é utilizado quando a concessionária decide devolver um […]",19/04/2023 18:00
economia,"Pix bate recorde mensal em março, com mais de 3 bilhões de transações, diz BC","O Pix bateu o recorde mensal de transações em março, ultrapassando a marca de 3 bilhões de operações. Segundo o Banco Central, foram 3,003 bilhões de transações no terceiro mês deste ano. O recorde anterior era de dezembro de 2022, de 2,873 bilhões de operações. Em volume financeiro, o Pix movimentou R$ 1,280 trilhão no […]",19/04/2023 17:58
economia,Toyota conta com R$ 1 bi em devolução de ICMS para produzir novo carro em SP,"A Toyota só anunciou o investimento na produção de um carro híbrido após enquadrar o projeto em um programa de incentivo paulista, o Pró Veículo Verde, no qual a montadora contará com a devolução de R$ 1 bilhão em crédito de ICMS. Durante o anúncio dos R$ 1,7 bilhão que serão investidos para a produção […]",19/04/2023 17:57
economia,"Empréstimos caem nos EUA e condições apertam em meio a incertezas, mostra Livro Bege","Os volumes e a demanda por empréstimos para pessoas físicas e jurídicas diminuíram de maneira geral nos Estados Unidos, aponta o Livro Bege, espécie de sumário das condições econômicas do Federal Reserve (Fed, o banco central norte-americano), divulgado nesta quarta-feira, 19. “Vários distritos notaram que os bancos apertaram os padrões de empréstimos em meio à […]",19/04/2023 17:18
economia,"Com Pix, Brasil fica em 2º em ranking de países por uso de pagamentos instantâneos em 2022","Com o sucesso do Pix, o Brasil foi o segundo país do mundo que mais utilizou meios de pagamentos instantâneos em 2022, ficando atrás apenas da Índia, conforme a pesquisa Prime Time for Real-Time Report, divulgado nesta quarta-feira, 19, em nota, pelo Banco Central. Foram 89,5 bilhões de transações na Índia, contra 29,2 bilhões de […]",19/04/2023 16:51
economia,"Cogeração de energia alcança 20,5 GW no Brasil, com crescimento de 4% em 12 meses","SÃO PAULO (Reuters) – O setor brasileiro de cogeração de energia chegou a 20,5 gigawatts (GW) de capacidade instalada operacional no Brasil, segundo dados até final de março apurados pela Associação da Indústria de Cogeração de Energia (Cogen), representando um crescimento de 4% nos últimos 12 meses. Com isso, a fonte, que conta com 654 […]",19/04/2023 16:33
economia,"Níveis de preços subiram moderadamente, mas parece haver desaceleração, diz Fed no Livro Bege","Os níveis gerais de preços aumentaram moderadamente nos Estados Unidos, embora a taxa de aumentos de preços parece ter desacelerando, de acordo com o Livro Bege do Federal Reserve (Fed, o banco central norte-americano). De acordo com a publicação, divulgada no período da tarde desta quarta-feira, 19, os contatos observaram quedas modestas a acentuadas nos […]",19/04/2023 16:32
economia,Bunge promove programa de “agricultura regenerativa” no Brasil,Por Ana Mano SÃO PAULO (Reuters) – A unidade brasileira da trading e processadora de commodities agrícolas Bunge informou nesta quarta-feira que está envolvendo fornecedores locais de grãos em seu “programa de agricultura regenerativa” com o objetivo de acelerar a transição para a agricultura de baixo carbono. A agricultura regenerativa geralmente envolve proteger e restaurar […],19/04/2023 16:28
economia,"Fluxo cambial total no ano até 14 de abril é positivo em US$ 11,439 bi, diz BC","O Brasil registrou fluxo cambial positivo de US$ 11,439 bilhões em 2023 até 14 de abril, informou o Banco Central (BC) nesta quarta-feira, 19. No mesmo período do ano passado, havia entrada líquida de US$ 12,390 bilhões. Em 2022, o saldo foi negativo em US$ 3,233 bilhões. No acumulado do ano, o canal financeiro apresentou […]",19/04/2023 16:05
economia,Syngenta anuncia conta digital para agricultores brasileiros; Bunge trabalha em fintech,"Por Roberto Samora SÃO PAULO (Reuters) – A Syngenta Proteção de Cultivos anunciou nesta quarta-feira o lançamento da Syde, conta digital em formato de aplicativo e internet banking para ampliar serviços a agricultores brasileiros, enquanto outra gigante do agronegócio, a Bunge, disse que está próxima concluir a estruturação de sua própria fintech. O lançamento de tais […]",19/04/2023 15:54
economia,Parlamento Europeu aprova lei que proíbe importação de produtos de áreas desmatadas,"O Parlamento Europeu aprovou, nesta quarta-feira (19), com ampla maioria, uma lei que fecha as portas à importação de produtos como cacau, café, madeira e borracha procedentes de áreas desmatadas após dezembro de 2020. É “a primeira lei do mundo que acaba com o desmatamento importado”, assegurou o eurodeputado Pascal Canfin (do bloco Renovar Europa, […]",19/04/2023 15:51
economia,"Atividade econômica dos EUA teve poucas alterações nas últimas semanas, mostra pesquisa do Fed","(Reuters) – A atividade econômica dos Estados Unidos mudou pouco nas últimas semanas, com moderação leve no crescimento do emprego e aparente desaceleração dos aumentos de preços, de acordo com um relatório do Federal Reserve publicado nesta quarta-feira. “As expectativas de crescimento futuro também permaneceram praticamente inalteradas; no entanto, dois distritos viram as perspectivas se […]",19/04/2023 15:34
economia,Funcionários públicos entram em greve no Canadá por reajuste salarial e trabalho remoto,"Um terço do funcionalismo público canadenses entrou em greve, nesta quarta-feira (19), para reivindicar reajuste salarial e mais teletrabalho, em um dos mais importantes movimentos sociais das últimas décadas no país. Depois de meses de negociações com o governo do primeiro-ministro Justin Trudeau, a Aliança da Função Pública do Canadá (AFPC, na sigla em francês), […]",19/04/2023 15:28
economia,Eduardo Bolsonaro vai para cima de deputado na Câmara,"O deputado federal Eduardo Bolsonaro (PL) ficou nervoso durante sessão na Câmara dos Deputados nesta quarta-feira (19) e foi para cima do deputado Dionilso Marcon (PT). + TSE mantém multa a Zambelli e Flávio Bolsonaro por postagem inverídica Ele ficou furioso após Marcon afirmar que a facada recebida pelo ex-presidente Jair Bolsonaro (PL), pai de […]",19/04/2023 15:27
economia,"Safra de grãos russa deve chegar a 123 mi t em 2023, diz ministro da Agricultura","Por Vladimir Soldatkin e Guy Faulconbridge MOSCOU (Reuters) – A Rússia terá uma boa colheita de grãos neste ano, de cerca de 123 milhões de toneladas, incluindo 78 milhões de toneladas de trigo, disse o ministro da Agricultura do país nesta quarta-feira, indicando que a produção será em torno de um quinto menor do que […]",19/04/2023 15:24
economia,Polônia celebra 80º aniversário do Levante do Gueto de Varsóvia,"VARSÓVIA (Reuters) – Oitenta anos depois do Levante do Gueto de Varsóvia, a maior revolta judaica contra a Alemanha nazista durante a Segunda Guerra Mundial, a Polônia marcou o heroísmo daqueles que participaram com um alerta ao mundo contra a semeadura do ódio. Em 1940, os ocupantes nazistas alemães encurralaram mais de 400.000 judeus em […]",19/04/2023 15:20
economia,Petrobras e BNDES terão comissão para projetos de transmissão energética e reindustrialização,"Petrobras e BNDES vão atuar juntos na elaboração de projetos ligados à transição energética, reindustrialização e fomento à pesquisa e desenvolvimento científico e tecnológico. A Petrobras informou nesta quarta-feira, 19, que seu presidente, Jean Paul Prates, e o presidente do Banco Nacional de Desenvolvimento Econômico e Social (BNDES), Aloizio Mercadante, começaram as tratativas para a […]",19/04/2023 15:00
economia,"Brasil registra saída líquida de US$ 1,250 bi em abril até dia 14, diz BC","SÃO PAULO (Reuters) – O Brasil registrou fluxo cambial total negativo de 1,250 bilhão de dólares em abril até o dia 14, em movimento puxado pela conta financeira, após encerrar março com entradas líquidas de 3,745 bilhões de dólares, informou nesta quarta-feira o Banco Central. Os dados mais recentes são preliminares e fazem parte das […]",19/04/2023 14:49
economia,"Meta fiscal será definida anualmente, mas sair do previsto teria custos, diz secretário de Política Econômica","BRASÍLIA (Reuters) – Embora o governo tenha declarado que buscará superávits primários a partir de 2025, a proposta de arcabouço não determina essa trajetória e delega à elaboração anual do Orçamento a definição das metas fiscais, que poderiam ser alteradas se preciso, afirmou o secretário de Política Econômica, Guilherme Mello. Em entrevista à Reuters nesta […]",19/04/2023 14:46
economia,"Saldo total da carteira de crédito deve subir 1,1% em março, projeta Febraban","O saldo total da carteira de crédito deverá voltar a crescer em março, com alta de 1,1%, após dois meses seguidos de ligeira contração, revela a Pesquisa Especial de Crédito da Federação Brasileira de Bancos (Febraban). Um dos destaques, segundo a entidade, é a estimativa de alta para o crédito destinado às famílias, que deve […]",19/04/2023 14:24
economia,"BCE: inflação começou a cair, mas inflação subjacente se mostra firme, diz Isabel Schnabel","Integrante do conselho do Banco Central Europeu (BCE), Isabel Schnabel apontou que, ao passo que o índice cheio da inflação começou a desacelerar na zona do euro, a inflação subjacente tem se mostrado persistente. Schnabel falou nesta quarta-feira, 19, sobre os desafios para a política monetária em tempos de inflação elevada, em palestra no Centro […]",19/04/2023 14:16
economia,"É necessário ver mais dados e como será dinâmica de inflação, diz Campos Neto","O presidente do Banco Central, Roberto Campos Neto, reforçou a desaceleração da inflação na margem, mas ponderou que, em termos de política monetária, é necessário ver mais dados e acompanhar a dinâmica inflacionária, até porque há incerteza sobre alguns preços importantes, como o petróleo. Ele citou, durante sua participação em reunião com investidores em Londres, […]",19/04/2023 13:50
economia,Márcio França e Casa Civil querem ‘leilão’ de passagens para assentos finais em aeroportos,"O ministro de Portos e Aeroportos, Márcio França, afirmou nesta quarta-feira, 19, que o governo quer acrescentar ao programa de passagens a R$ 200 o conceito de “leilão” de tíquetes com assentos “finais” que sobrarem nas aeronaves. Segundo ele, a prática é comum em aeroportos europeus e foi sugerida pela Casa Civil. “Nessa proposta dos […]",19/04/2023 13:48
negocios,"Ibovespa tem leve alta em sessão de ajuste, mas registra queda semanal","Por Andre Romani SÃO PAULO (Reuters) – O Ibovespa fechou em leve alta nesta quinta-feira, antes de feriado de Tiradentes no Brasil, destoando de Wall Street, com certa correção após queda de mais de 2% na véspera. Apesar do desempenho positivo na sessão, o Ibovespa encerrou a semana no vermelho, diante, em especial, de preocupações […]",20/04/2023 17:56
negocios,Alphabet combinará unidades de pesquisa de inteligência artificial Google Brain e DeepMind,"(Reuters) – A Alphabet está unindo o Google Brain e o DeepMind, enquanto intensifica a pesquisa em inteligência artificial em sua corrida para competir com sistemas rivais como o chatbot ChatGPT, da OpenAI. A nova divisão será liderada pelo presidente-executivo da DeepMind, Demis Hassabis, e sua criação garantirá o “desenvolvimento ousado e responsável da inteligência […]",20/04/2023 17:55
negocios,Associação de minoritários faz pedido à CVM sobre 3R Petroleum,"Por Rodrigo Viga Gaier RIO DE JANEIRO (Reuters) – A Abradin, associação de acionistas minoritários de empresas de capital aberto, anunciou nesta quinta-feira que fez à Comissão de Valores Mobiliários (CVM) pedido de investigação citando supostas irregularidades na 3R Petroleum, que anunciou recentemente uma oferta de ações que derrubou o preço do papel. A Abradin […]",20/04/2023 17:37
negocios,Dólar à vista cai ante real com realização de lucros e influência do exterior,"Por Fabrício de Castro SÃO PAULO, 20 Abr (Reuters) – Após a forte alta da véspera, com investidores reagindo negativamente ao texto do novo arcabouço fiscal, o dólar fechou em baixa nesta quinta-feira, com a sessão conduzida por certa realização de lucros e pelo viés negativo da moeda norte-americana durante a tarde no exterior. O […]",20/04/2023 17:34
negocios,"Renault escolhe bancos para IPO da unidade de carros elétricos Ampere, diz fonte","Por Silvia Aloisi PARIS (Reuters) – A Renault escolheu o BNP Paribas, Goldman Sachs e JPMorgan entre os bancos de investimento destinados a trabalhar na listagem planejada de sua unidade de carros elétricos, a Ampere, disse uma fonte próxima ao assunto nesta quinta-feira. Os três bancos atuarão juntos como coordenadores globais na oferta pública inicial […]",20/04/2023 17:28
negocios,Shein anuncia que vai fabricar roupas no Brasil e prevê investir R$ 750 mi no País,"A varejista de moda chinesa Shein anunciou nesta quinta-feira, 20, que vai começar a fabricar suas roupas no Brasil, em um investimento que pode gerar 100 mil empregos em três anos. Inicialmente, deve gastar R$ 750 milhões para fornecer tecnologias e treinamento a fabricantes têxteis brasileiros. O anúncio acontece em meio a pressão de concorrentes […]",20/04/2023 17:21
negocios,Wall St cai após resultado trimestral da Tesla e outros balanços decepcionantes,"Por Lewis Krauskopf e Sruthi Shankar e Ankika Biswas (Reuters) – Os principais índices de ações dos Estados Unidos fecharam em queda nesta quinta-feira, após relatórios trimestrais decepcionantes de empresas como Tesla e AT&T, enquanto investidores buscavam clareza sobre a trajetória da taxa de juros. Segundo dados preliminares, o S&P 500 perdeu 0,59%, para 4.129,99 […]",20/04/2023 17:13
negocios,Hotel de Trancoso aparece em lista dos 100 melhores do mundo; saiba qual,"Um hotel luxuoso brasileiro apareceu no ranking dos 100 melhores hotéis do mundo, segundo a revista Travel + Leisure. “O Fasano combinou seu estilo urbano característico com a vida descontraída à beira-mar, oferecendo 40 bangalôs modernos e luxuosos escondidos entre altas palmeiras e vegetação exuberante”, escreve a publicação que elegeu a unidade da franquia de […]",20/04/2023 17:12
negocios,Taxas dos contratos de DI caem em dia de ajuste após pessimismo com arcabouço,"Por Fabrício de Castro SÃO PAULO, 20 Abr (Reuters) – As taxas dos contratos futuros de juros recuaram nesta quinta-feira em toda curva a termo, em um movimento de ajuste após o forte avanço da véspera –quando investidores reagiram negativamente ao texto do novo arcabouço fiscal– e em meio ao recuo dos rendimentos dos Treasuries, […]",20/04/2023 16:56
negocios,BuzzFeed fechará divisão de notícias e demitirá 15% da equipe,"(Reuters) – O BuzzFeed disse que fechará sua divisão de notícias para consolidar seu conteúdo de notícias no HuffPost e reduzirá sua força de trabalho em 15%, fazendo com que as ações da empresa de mídia digital caíssem 10% nesta quinta-feira. A segunda rodada de demissões afetará 180 funcionários, incluindo equipes de negócios, conteúdo, tecnologia […]",20/04/2023 15:49
