Secao,Titulo,Descrição,Data
economia,"EUA enviarão tropas ao Djibuti para eventual desocupação de embaixada no Sudão, diz autoridade","WASHINGTON (Reuters) – Os Estados Unidos estão se preparando para enviar um grande número de tropas adicionais para sua base em Djibuti no caso de uma eventual retirada de cidadãos norte-americanos do Sudão, disse uma autoridade norte-americana nesta quinta-feira, quando novos conflitos armados irromperam. O funcionário, falando sob condição de anonimato, se recusou a dar […]",20/04/2023 17:40
economia,"Colheita de soja 22/23 atinge 54% da área no RS, diz Emater; alerta para novos cortes","SÃO PAULO (Reuters) – A colheita de soja 2022/23 alcançou 54% das áreas cultivadas no Rio Grande do Sul, avanço semanal de 22 pontos percentuais, informou nesta quinta-feira a Emater-RS, sinalizando que ainda pode reduzir neste mês sua projeção sobre os rendimentos das lavouras, que foram afetadas anteriormente por uma seca. Em março, a empresa […]",20/04/2023 17:39
economia,Shein anuncia que vai fabricar roupas no Brasil e prevê investir R$ 750 mi no País,"A varejista de moda chinesa Shein anunciou nesta quinta-feira, 20, que vai começar a fabricar suas roupas no Brasil, em um investimento que pode gerar 100 mil empregos em três anos. Inicialmente, deve gastar R$ 750 milhões para fornecer tecnologias e treinamento a fabricantes têxteis brasileiros. O anúncio acontece em meio a pressão de concorrentes […]",20/04/2023 17:21
economia,DeSantis assina projeto de lei para facilitar aplicação de pena de morte na Flórida,"Por Tyler Clifford (Reuters) – O governador da Flórida, Ron DeSantis, assinou um projeto de lei nesta quinta-feira encerrando uma exigência de que os júris precisam votar por unanimidade para recomendar a pena de morte antes que um juiz em um julgamento de crime capital possa sentenciar um réu à morte. O governador republicano, que […]",20/04/2023 15:57
economia,"Fed está mais perto que do que longe, diz dirigente, sobre fim do ciclo de aperto monetário","A presidente do Federal Reserve (Fed, o banco central norte-americano) de Cleveland, Loretta Mester, disse que o banco central está mais perto do que longe de chegar ao fim do ciclo de aperto monetário. “O Fed percorreu um longo caminho no aperto à política monetária”, declarou, em coletiva de imprensa nesta quinta. Loretta Mester disse […]",20/04/2023 15:44
economia,Opas inicia negociações com farmacêutica Takeda sobre preços de vacinas contra a dengue,"(Reuters) – A Organização Pan-Americana da Saúde (Opas) está em negociações preliminares com a farmacêutica japonesa Takeda sobre possíveis encomendas de sua vacina contra a dengue, disse o diretor da organização nesta quinta-feira, embora a instituição ainda não tenha decidido se recomendará o imunizante. “Os dados são realmente muito impressionantes”, disse o diretor da Opas, Jarbas […]",20/04/2023 15:41
economia,Rabobank reduz safra de café do Brasil após corte na previsão para arábica,"Por Roberto Samora SÃO PAULO (Reuters) – A safra de café do Brasil na temporada 2023/24 foi estimada em 66 milhões de sacas de 60 kg, com um corte de 1,1 milhão de sacas ante a previsão anterior, após expectativa de menores produtividades em áreas de arábica de Minas Gerais, afirmou o Rabobank nesta quinta-feira. […]",20/04/2023 15:35
economia,"IGC eleva projeção da safra global 2022/23 de grãos, para 2,252 bilhões de toneladas","O Conselho Internacional de Grãos (IGC, na sigla em inglês) aumentou sua previsão de produção global de grãos na temporada 2022/23, para 2,252 bilhões de toneladas, ante 2,250 bilhões de toneladas da previsão divulgada em março, principalmente por causa da expectativa de aumento da produção de trigo, justificou o IGC. No entanto, caso confirmado, o […]",20/04/2023 15:18
economia,"Banco Inter pede que funcionários evitem cabelo sem corte, chulé, bolsa velha e roupa amassada","Telefone celular com capinha velha, acessórios sujos ou estragados, chulé e cabelo desarrumado. Esses são alguns dos itens listados pelo Banco Inter em cartilha compartilhada com funcionários que traz “dicas” de estilo e comportamento sugeridas durante o expediente. O documento, intitulado de “os inimigos da imagem”, reúne 14 normas para serem evitadas “a todo custo”. […]",20/04/2023 15:13
economia,BC pede projeções mensais de núcleos e de fiscal de longo prazo em pesquisa pré-Copom,"O Banco Central (BC) pediu projeções mensais de núcleos de inflação e estimativas fiscais de longo prazo na pesquisa pré-Copom de maio. O encontro será nos dias 2 e 3 do mês que vem. Na quarta-feira, 19, o presidente do BC, Roberto Campos Neto, afirmou que a inflação brasileira tem diminuído, mas que os núcleos, […]",20/04/2023 14:40
economia,Haddad diz que Shein pretende nacionalizar 85% das vendas nos próximos anos,"O ministro da Fazenda, Fernando Haddad, afirmou nesta quinta-feira, 20, que a e-commerce chinesa Shein pretende nacionalizar 85% de suas vendas em quatro anos, com produtos feitos no Brasil. O anúncio deve ser feito ainda nesta quinta pela Shein, adiantou o ministro, que se reuniu com a empresa no período da manhã. “Eles próprios vão […]",20/04/2023 14:36
economia,Fazenda anuncia medidas para desburocratizar concessão de crédito,"O secretário de Reformas Econômicas do Ministério da Fazenda, Marcos Barbosa Pinto, anunciou nesta quinta-feira, 20, medidas para desburocratizar a concessão de crédito, com a dispensa de documentos, além de simplificar o processo para a emissão de debêntures. “Estamos simplificando bastante o processo de emissão das debêntures. A lei criou procedimentos burocráticos”, disse Pinto, segundo […]",20/04/2023 14:22
economia,Publicação digital BuzzFeed News vai encerrar suas atividades nos EUA,"A publicação digital BuzzFeed News, símbolo da nova imprensa na Internet, vai encerrar suas atividades, no âmbito de um plano de ajustes, anunciou o diretor da BuzzFeed, Jonah Peretti, nesta quinta-feira (20), em uma nota interna, à qual a AFP teve acesso. “Estamos reduzindo nosso quadro de funcionários em cerca de 15% hoje… e iniciando […]",20/04/2023 14:15
economia,"Vendas de café do Brasil ganham ritmo com início da colheita e preços melhores, diz Safras","SÃO PAULO (Reuters) – As vendas de café brasileiro do ciclo 2023/24 ganharam ritmo com o início da colheita de grãos conilon e pela alta nos preços, apontou nesta quinta-feira a consultoria Safras & Mercado, estimando que os produtores tinham vendido 23% do potencial da produção nacional até o último dia 17 de abril. Em […]",20/04/2023 13:58
economia,Dirigente do Fed prevê juros em nível superior a 5% por algum tempo nos EUA,"A presidente da distrital do Federal Reserve (Fed, o banco central norte-americano) em Cleveland, Loretta Mester, afirmou, nesta quinta-feira, 20, que a autoridade monetária terá que aumentar juros ao pico superior a 5% e mantê-lo nesse nível por algum tempo. Atualmente, a taxa básica está na faixa entre 4,75% e 5,00%. Em discurso em Ohio, […]",20/04/2023 13:58
economia,"Haddad sobre e-commerce: governo seguirá países desenvolvidos, com imposto digital à empresa","O ministro da Fazenda, Fernando Haddad, afirmou nesta quinta-feira, 20, que o governo pretende solucionar a questão da taxação do e-commerce seguindo o exemplo de países desenvolvidos, com um imposto digital. O ministro também disse que a alternativa atende a sinalização do presidente da República, Luiz Inácio Lula da Silva, que pediu uma solução administrativa […]",20/04/2023 13:38
economia,"Crédito imobiliário do SBPE sobe 17,6% em 1 ano e atinge R$ 17,4 bi em março, diz Abecip","Os financiamentos imobiliários com recursos das cadernetas do Sistema Brasileiro de Poupança e Empréstimo (SBPE) somaram R$ 17,4 bilhões em março de 2023, um aumento de 17,6% ante o registrado um ano antes. Na comparação com fevereiro, o crescimento foi de 66,4%, informou a Associação Brasileira das Entidades de Crédito Imobiliário e Poupança (Abecip). No […]",20/04/2023 13:27
economia,Fazenda tem 153 projetos de PPPs no radar e vê interesse de bancos no modelo de garantia,"O Ministério da Fazenda calcula que existam 153 projetos de Parcerias Público-Privadas (PPPs) em fase de estruturação ou licitação pelo País. O governo federal vai passar a apoiar essas modelagens de Estados e municípios por meio de operações com garantia do Tesouro Nacional. Basicamente, a garantia poderá ser usada em aportes feitos nas PPPs para […]",20/04/2023 12:52
economia,Presidente de Uganda consulta parlamentares sobre projeto de lei anti-LGBTQ,"KAMPALA (Reuters) – O presidente de Uganda, Yoweri Museveni, se reuniu com parlamentares de seu partido nesta quinta-feira para discutir um projeto de lei anti-LGBTQ rígido antes do prazo para sancionar, vetar ou enviar a medida de volta ao Parlamento para revisões. Ativistas de direitos humanos e o governo dos Estados Unidos dizem que o […]",20/04/2023 12:48
economia,França quer restrição a produtos de áreas desmatadas no acordo UE-Mercosul,A negociação para um acordo comercial entre União Europeia (UE) e Mercosul deve levar em consideração a lei contra a importação de produtos de áreas desmatadas aprovada pelo Parlamento Europeu na quarta-feira (19) – afirmou a França nesta quinta (20). “Todos os acordos comerciais da União Europeia devem levar em consideração o respeito das normas […],20/04/2023 12:45
economia,Fazenda tem 153 projetos de PPPs no radar e vê interesse de bancos no modelo de garantia,"O Ministério da Fazenda calcula que existam 153 projetos de Parcerias Público-Privadas (PPPs) em fase de estruturação ou licitação pelo País. O governo federal vai passar a apoiar essas modelagens de Estados e municípios por meio de operações com garantia do Tesouro Nacional. Basicamente, a garantia poderá ser usada em aportes feitos nas PPPs para […]",20/04/2023 12:52
economia,Presidente de Uganda consulta parlamentares sobre projeto de lei anti-LGBTQ,"KAMPALA (Reuters) – O presidente de Uganda, Yoweri Museveni, se reuniu com parlamentares de seu partido nesta quinta-feira para discutir um projeto de lei anti-LGBTQ rígido antes do prazo para sancionar, vetar ou enviar a medida de volta ao Parlamento para revisões. Ativistas de direitos humanos e o governo dos Estados Unidos dizem que o […]",20/04/2023 12:48
economia,França quer restrição a produtos de áreas desmatadas no acordo UE-Mercosul,A negociação para um acordo comercial entre União Europeia (UE) e Mercosul deve levar em consideração a lei contra a importação de produtos de áreas desmatadas aprovada pelo Parlamento Europeu na quarta-feira (19) – afirmou a França nesta quinta (20). “Todos os acordos comerciais da União Europeia devem levar em consideração o respeito das normas […],20/04/2023 12:45
economia,Eletrobras propõe aporte de R$ 4 bi para adiantar dívidas de Santo Antônio Energia com bancos,"Em meio aos esforços da Eletrobras para capitalizar e reestruturar as dívidas de sua controlada indireta Santo Antônio Energia, responsável pela hidrelétrica de mesmo nome, a companhia planeja realizar uma operação envolvendo um aporte financeiro de R$ 4 bilhões para o pré-pagamento de dívidas e assumir o débito restante junto ao Banco Nacional de Desenvolvimento […]",20/04/2023 12:44
economia,STF julga ação que pode flexibilizar fim da contribuição sindical obrigatória,"O Supremo Tribunal Federal (STF) julga em plenário virtual, até a próxima segunda-feira, 24, se todos os empregados, sindicalizados ou não, são obrigados a pagar contribuição assistencial prevista em acordo coletivo. Os ministros julgam recurso de entidades sindicais contra decisão da Corte de 2017 que determinou que essa obrigação abrange apenas funcionários filiados ao sindicato […]",20/04/2023 12:35
economia,Advogados do ex-presidente peruano Toledo tentam impedir extradição nos EUA,"WASHINGTON (Reuters) – Advogados do ex-presidente peruano Alejandro Toledo entraram com pedido de estadia emergencial em um tribunal federal dos Estados Unidos nesta quinta-feira para impedir sua extradição ao Peru, onde ele enfrenta acusações de corrupção. Os advogados argumentaram no início da manhã que a suspensão de sua detenção e extradição é “necessária para evitar […]",20/04/2023 12:32
economia,Biden anuncia US$ 500 milhões para Fundo Amazônia nos próximos 5 anos,"Por Lisandra Paraguassu e Jeff Mason BRASÍLIA/WASHINGTON (Reuters) – O presidente dos Estados Unidos, Joe Biden, anunciou nesta quinta-feira que pretende aplicar 500 milhões de dólares no Fundo Amazônia nos próximos cinco anos, durante o Fórum Virtual de Grandes Economias sobre Clima e Energia, do qual o Brasil participa. Um funcionário de alto escalão do […]",20/04/2023 12:29
economia,"Vendas de moradias usadas nos EUA caem 2,4% em março ante fevereiro","As vendas de moradias usadas nos Estados Unidos recuaram 2,4% em entre fevereiro e março, para uma taxa anual ajustada sazonalmente 4,44 milhões, informou nesta quinta-feira, 20, a Associação Nacional de Corretoras (NAR, na sigla em inglês). Analistas ouvidos pelo Wall Street Journal previam queda menor, de 2,0%, ao nível de 4,49 milhões. Fonte: Dow […]",20/04/2023 12:23
economia,"Medidas para PPPs e concessões federais são lideradas pela Casa Civil, diz Ceron","O secretário do Tesouro, Rogério Ceron, afirmou que as discussões sobre o desenho de apoio a PPPs que serão estruturadas pelo governo federal são lideradas pelo ministro da Casa Civil, Rui Costa. Nesta quinta-feira, 20, a Fazenda anunciou novos instrumentos apenas para garantir as PPPs organizadas pelos Estados e municípios. “Essas medidas relacionadas às PPPs […]",20/04/2023 12:17
economia,"Confiança do consumidor da zona do euro sobe a -17,5 em abril, mostra preliminar","O índice de confiança do consumidor da zona do euro avançou de -19,1 em março a -17,5 na preliminar de abril, informou nesta quinta-feira, 20, a Comissão Europeia. Analistas ouvidos pelo Wall Street Journal projetavam -18,5.",20/04/2023 12:05
economia,Prêmios de soja no Brasil despencam com safra recorde e demanda chinesa mais fraca,"Por Ana Mano SÃO PAULO (Reuters) – Os prêmios da soja brasileira nos portos caíram para mínimas históricas nos últimos dias em meio ao arrefecimento da demanda chinesa, enquanto o país colhe uma safra recorde, disseram analistas e traders. Os prêmios caíram para -200 pontos base por bushel esta semana em portos como Paranaguá para […]",20/04/2023 11:56
economia,Quem é o ex-ministro Gonçalves Dias e como Lula não soube que ele estava nos atos golpistas de 8/1,"Primeiro ministro a deixar o cargo na terceira gestão de Luiz Inácio Lula da Silva (PT), o general Gonçalves Dias, que até esta quinta (19) era ministro-chefe do Gabinete de Segurança Institucional (GSI), esteve no Palácio do Planalto durante o ataque terrorista de 8/1, quando apoiadores do ex-presidente Jair Bolsonaro invadiram os Três Poderes. Sua […]",20/04/2023 11:55
economia,"Preços da batata, cebola e tomate registram queda no atacado em março, diz Conab","O movimento preponderante de preços para batata, cebola e tomate foi de queda na maioria das Centrais de Abastecimento (Ceasas), em março. Os dados fazem parte do 4º Boletim do Programa Brasileiro de Modernização do Mercado Hortigranjeiro (Prohort), da Companhia Nacional de Abastecimento (Conab), divulgado nesta quinta-feira, 20. A alface e a cenoura apresentaram tendência […]",20/04/2023 11:55
economia,"Governo ampliará setores com acesso a debêntures incentivadas, com foco ambiental e social","O governo Lula vai ampliar os setores que poderão acessar as debêntures incentivadas, que garantem isenção no imposto de renda. É uma das medidas anunciadas nesta quinta-feira, 20, para ampliar o grau de investimentos no País. Haverá uma alteração no decreto 8874/2026 para dispor sobre incentivo e financiamento de projetos de infraestrutura com benefícios ambientais […]",20/04/2023 11:28
economia,"Mulheres que enfrentam violência podem obter status de refugiadas da UE, diz consultor de tribunal","Por Marine Strauss e Tassilo Hummel PARIS (Reuters) – Mulheres de fora da União Europeia em risco de crimes de “honra”, casamentos forçados ou violência doméstica em seu país de origem podem receber o status de refugiadas, disse um importante consultor do Tribunal Europeu de Justiça (ECJ, na sigla em inglês) nesta quinta-feira. Um advogado-geral […]",20/04/2023 11:22
economia,"IGC eleva safra mundial de milho 23/24 com impulso dos EUA, que volta a liderar exportação","LONDRES (Reuters) – O Conselho Internacional de Grãos (IGC, na sigla em inglês) elevou nesta quinta-feira sua previsão para a produção global de milho 2023/24, com impulso principalmente de uma perspectiva melhora nos Estados Unidos. O órgão intergovernamental, em uma atualização mensal, estimou a produção global de milho para a temporada 2023/24 em 1,208 bilhão […]",20/04/2023 11:08
economia,EXCLUSIVO-Comandante militar russo supervisionou reinado do medo em cidade da Ucrânia,"Por Mari Saito e Polina Nikolskaya e Maria Tsvetkova e Anton Zverev BALAKLIIA, Ucrânia (Reuters) – Durante um interrogatório feito por agentes da inteligência russa em uma delegacia de polícia na cidade de Balakliia, na Ucrânia, em junho, o empresário local Ruslan Volobuyev foi espancado por um dos homens, disse ele. A certa altura, de […]",20/04/2023 11:04
economia,"Com Campos Neto na plateia em evento em Londres, Pacheco cobra ‘redução imediata’ dos juros","Em discurso feito nesta quinta-feira, 20, na abertura do Lide Brazil Conference em Londres, o presidente do Senado, Rodrigo Pacheco (PSD-MG), defendeu a “redução imediata” da taxa de juros e voltou a prometer “rapidez” na aprovação do projeto do novo arcabouço fiscal enviado ao Congresso pelo ministro da Fazenda, Fernando Haddad (PT) Alvo de críticas […]",20/04/2023 11:00
economia,Governo anuncia medidas para estimular crédito e PPPs,"Por Camila Moreira SÃO PAULO (Reuters) -O governo anunciou nesta quinta-feira um pacote com 13 medidas para estimular o crédito e participações público-privadas (PPPs), com o objetivo de facilitar o acesso e reduzir as taxas de juros no mercado de crédito, em um momento de aperto no Brasil da oferta. Segundo documento divulgado pelo Ministério […]",20/04/2023 10:56
economia,"Índice de inadimplência do País sobe 5,1% no 1º trimestre, mostra Boa Vista","O indicador da Boa Vista que mede a inadimplência no País registrou alta de 2,3% em março, após subir 0,2% em fevereiro. Com isso, encerrou o primeiro trimestre com crescimento de 5,1% na comparação com o período de outubro a dezembro de 2022. Na série de dados originais o aumento na comparação interanual ainda é […]",20/04/2023 10:35
economia,Conab vê safra de cana 22/23 do Brasil encerrando acima do previsto,"SÃO PAULO (Reuters) -A produção de cana-de-açúcar do Brasil somou 610,1 milhões de toneladas, crescimento de 5,4% em relação à temporada passada, afirmou a Companhia Nacional de Abastecimento (Conab) nesta quinta-feira, ao divulgar números da safra 2022/23 recém-encerrada. Isso representa uma elevação ante o volume de 598,3 milhões de toneladas estimado no último levantamento do […]",20/04/2023 10:30
economia,Fazenda apresenta dois modelos de garantia da União em aportes e prestações de PPPs,"A equipe econômica divulgou detalhes nesta quinta-feira, 20, sobre como irá apoiar as Parcerias Público-Privadas (PPPs) de Estados e municípios por meio do Tesouro. Serão dois modelos. Um de garantia da União para o financiamento de aportes, que viabiliza operações de crédito para aplicação de recursos públicos do Estado ou município na PPP durante a […]",20/04/2023 10:12
economia,Família de Schumacher vai apresentar queixa após falsa entrevista por IA,"A família de Michael Schumacher vai apresentar uma queixa contra a revista alemã Die Aktuelle, que publicou uma entrevista falsa com o lendário piloto alemão de Fórmula 1, realizada com Inteligência Artificial (IA), informou a rede de televisão esportiva americana ESPN nesta quinta-feira (20). A revista afirmou que tinha uma entrevista com Michael Schumacher, a […]",20/04/2023 10:08
economia,Greenpeace pede que fabricantes asiáticos de semicondutores reduzam emissões poluentes,"O Greenpeace pediu nesta quinta-feira (20) aos fabricantes asiáticos de semicondutores, como TSMC e Samsung, que se comprometam a reduzir as emissões de gases de efeito estufa, na expectativa de um aumento do consumo de energia de combustíveis fósseis para essa atividade. Em um novo relatório, a ONG ambiental afirma que a indústria global de […]",20/04/2023 10:03
economia,Por que Lula mudou posição sobre guerra na Ucrânia? Celso Amorim poder ter a resposta,"Após ter afirmado que a guerra da Ucrânia teria sido fruto da decisão de dois países (Rússia e Ucrânia) e que Estados Unidos e União Europeia estariam incentivando o conflito, o presidente Lula (PT) mudou o tom de suas afirmações sobre o confronto nesta última terça-feira (18) e condenou a “violação da integridade territorial” da […]",20/04/2023 09:52
economia,"Pedidos de auxílio-desemprego nos EUA sobem 5 mil na semana, a 245 mil","Os novos pedidos de auxílio-desemprego nos Estados Unidos avançaram 5 mil na semana encerrada em 15 de abril, de 240 mil (dado revisado, de 239 mil antes informado) a 245 mil, informou nesta quinta-feira, 20, o Departamento do Trabalho. Analistas ouvidos pelo Wall Street Journal previam 240 mil. Os pedidos continuados de auxílio-desemprego, que saem […]",20/04/2023 09:45
economia,"Para evitar ‘pedalada’, Centrão quer pôr punição no texto da regra fiscal","O dispositivo que retira a punição ao presidente da República caso descumpra a meta fiscal – incluído no texto do arcabouço encaminhado na terça-feira pelo governo federal ao Congresso – deve enfrentar forte resistência dos parlamentares, sobretudo do Centrão. Na avaliação do líder do PP na Câmara, André Fufuca, esse é um dos pontos do […]",20/04/2023 09:30
economia,Hungria proíbe importação de mel e certos produtos de carne da Ucrânia,"Por Boldizsar Gyori e Krisztina Than BUDAPESTE (Reuters) – A Hungria proibiu as importações de mel e certos produtos à base de carne, além de grãos, da Ucrânia até 30 de junho, disse o chefe de gabinete do primeiro-ministro na quinta-feira, aumentando a pressão sobre Bruxelas para ampliar medidas propostas em toda a União Europeia. […]",20/04/2023 09:22
economia,BCE/ata: tensões financeiras eram vistas como fonte de incerteza significativa para inflação,"Os dirigentes do Banco Central Europeu (BCE) consideraram, na mais recente reunião de política monetária, que as tensões financeiras recentes eram “fonte de incerteza significativa” para o crescimento econômico e também a inflação, revelou a ata do encontro, publicada nesta quinta-feira, 20. O documento aponta que o comando do BCE reforçou que reagirá aos dados, […]",20/04/2023 09:14
economia,Combates abalam capital do Sudão e moradores tentam fugir,"Por Khalid Abdelaziz e Nafisa Eltahir CARTUM (Reuters) – Moradores da capital do Sudão relataram novos disparos pesados nesta quinta-feira, enquanto milhares tentavam fugir dos combates que mataram dezenas de civis, antes do feriado de Eid, que marca o fim do mês sagrado do Ramadã. Cartum e suas cidades irmãs Omdurman e Bahri, uma das […]",20/04/2023 08:56
economia,Arcabouço pode conter mecanismo para Lula controlar o Banco Central,"Entregue ao Congresso Nacional nesta terça-feira (18), o texto da proposta do arcabouço fiscal prevê uma série de medidas para arrecadação e controle de receita pelo governo federal. Via o projeto de lei complementar 93/2023, a medida prevê também mecanismo de controle para resultados. Uma delas pode garantir uma ‘brecha’ para que o governo Luiz […]",20/04/2023 08:21
economia,"PPI da Alemanha sobe 7,5% na comparação anual de março","A inflação ao produtor (PPI, na sigla em inglês) da Alemanha desacelerou pelo sexto mês consecutivo, depois de renovar máxima histórica em setembro do ano passado. Dados da Destatis, como é conhecida a agência de estatísticas do país, mostram que a taxa anual do PPI alemão ficou em 7,5% em março, perdendo força em relação […]",20/04/2023 08:15
economia,"EUA quer relação econômica ‘construtiva e equitativa’ com a China, diz Yellen","Os Estados Unidos querem ter uma relação econômica “construtiva e equitativa” com a China, mas sem comprometer as questões de segurança nacional, disse a secretária do Tesouro, Janet Yellen, em discurso na Universidade Johns Hopkins, em Washington, nesta quinta-feira (20). “Buscamos uma relação econômica saudável com a China: uma que promova o crescimento e a […]",20/04/2023 07:51
economia,"EUA: continuaremos a responder com aliados a práticas econômicas injustas da China, diz Yellen","A secretária do Tesouro dos Estados Unidos, Janet Yellen, defende a cooperação e uma relação “construtiva e justa” com a China, mas também diz que o governo americano “continuará a responder” com seus aliados a “práticas econômicas injustas” de Pequim. As declarações fazem parte de um discurso que a autoridade americana realiza nesta quinta-feira, 20, […]",20/04/2023 07:29
